{
  "schema_version": "1.0",
  "status": "BLOCKED_NATIVE_REFERENCE_BIND_UNVERIFIED",
  "error_code": "BLOCKED_NATIVE_REFERENCE_BIND_UNVERIFIED",
  "surface": {
    "kind": "CHAT",
    "native_image_generation_available": true
  },
  "source": {
    "provider": "google-drive",
    "file_id": "1mPsJ38k7xfxStY3tNLnR3_OZW7U3XOIb",
    "file_name": "02_LEFT_SIDE_TPOSE_CANONICAL_LOCKED.png",
    "mime_type": "image/png",
    "size_bytes": 1469732,
    "width": 1024,
    "height": 1536,
    "exact_match": true,
    "raw_fetch": true
  },
  "integrity": {
    "verification_available": true,
    "verified": true,
    "sha256_after_fetch": "99c36237f3b84d98d674ded2f95a8c137096f0b6fea1875da189e7254e7276ee",
    "sha256_before_bind": "99c36237f3b84d98d674ded2f95a8c137096f0b6fea1875da189e7254e7276ee"
  },
  "reference_bind": {
    "bound": false,
    "evidence_id": null
  },
  "native_generation": {
    "generator": "none",
    "invoked": false,
    "reference_count": 0,
    "result_inline": false,
    "external_api_calls": 0,
    "api_fallback_used": false
  },
  "security": {
    "drive_write_calls": 0,
    "sharing_changes": 0,
    "secrets_exposed": false,
    "raw_pixels_logged": false
  }
}
